{
  "schema_version": "1.0.0",
  "generated_at": "2026-09-14",
  "purpose": "Candidate primary-source registry for the future private Support Ingestion Engine. This file stores source metadata only; it does not assert user eligibility or publish unverified support rules.",
  "automation_guardrails": {
    "robots_and_terms_review_required_before_crawling": true,
    "prefer_api_or_structured_data_when_available": true,
    "no_personal_data": true,
    "no_user_case_data": true,
    "product_use_requires_verified_support_records": true
  },
  "sources": [
    {
      "source_id": "se-forsakringskassan-benefits-a-z",
      "owner": "Försäkringskassan",
      "authority_type": "national_agency",
      "url": "https://www.forsakringskassan.se/privatperson/ersattningar-a-o",
      "geography": "SE",
      "coverage": ["family", "sickness", "disability", "housing", "dental", "labour_market"],
      "source_type": "official_catalog",
      "ingestion_method": "html_catalog",
      "priority": "P0",
      "suggested_review_frequency_days": 7,
      "source_verification_status": "SOURCE_VERIFIED",
      "last_source_check": "2026-09-05",
      "adapter_state": "CANDIDATE"
    },
    {
      "source_id": "se-pensionsmyndigheten-pensioner-support",
      "owner": "Pensionsmyndigheten",
      "authority_type": "national_agency",
      "url": "https://www.pensionsmyndigheten.se/for-pensionarer",
      "geography": "SE",
      "coverage": ["pension", "housing", "survivor_support", "low_income"],
      "source_type": "official_catalog",
      "ingestion_method": "html_catalog",
      "priority": "P0",
      "suggested_review_frequency_days": 14,
      "source_verification_status": "SOURCE_VERIFIED",
      "last_source_check": "2026-09-05",
      "adapter_state": "CANDIDATE"
    },
    {
      "source_id": "se-arbetsformedlingen-support-a-z",
      "owner": "Arbetsförmedlingen",
      "authority_type": "national_agency",
      "url": "https://arbetsformedlingen.se/for-arbetssokande/extra-stod/stod-a-o",
      "geography": "SE",
      "coverage": ["unemployment", "employment", "disability", "rehabilitation", "newly_arrived"],
      "source_type": "official_catalog",
      "ingestion_method": "html_catalog",
      "priority": "P0",
      "suggested_review_frequency_days": 7,
      "source_verification_status": "SOURCE_VERIFIED",
      "last_source_check": "2026-09-05",
      "adapter_state": "CANDIDATE"
    },
    {
      "source_id": "se-csn-grants-loans",
      "owner": "Centrala studiestödsnämnden (CSN)",
      "authority_type": "national_agency",
      "url": "https://www.csn.se/bidrag-och-lan.html",
      "geography": "SE",
      "coverage": ["education", "student_finance", "career_transition"],
      "source_type": "official_catalog",
      "ingestion_method": "html_catalog",
      "priority": "P0",
      "suggested_review_frequency_days": 14,
      "source_verification_status": "SOURCE_VERIFIED",
      "last_source_check": "2026-09-05",
      "adapter_state": "CANDIDATE"
    },
    {
      "source_id": "se-skolverket-school-support",
      "owner": "Skolverket",
      "authority_type": "national_agency",
      "url": "https://www.skolverket.se/styrning-och-ansvar/regler-och-ansvar/ansvar-i-skolfragor/extra-anpassningar-sarskilt-stod-och-atgardsprogram",
      "geography": "SE",
      "coverage": ["education", "children_youth", "school_support", "special_support"],
      "source_type": "official_guidance",
      "ingestion_method": "html_guidance",
      "priority": "P0",
      "suggested_review_frequency_days": 14,
      "source_verification_status": "SOURCE_VERIFIED",
      "last_source_check": "2026-09-14",
      "adapter_state": "CANDIDATE",
      "notes": "Source verification confirms the official authority and current guidance location only. It does not make normalized legal/process fields VERIFIED or decide a pupil's individual support measure. Appeal facts must also be checked against Skolväsendets överklagandenämnd."
    },
    {
      "source_id": "se-socialstyrelsen-financial-assistance",
      "owner": "Socialstyrelsen",
      "authority_type": "national_agency",
      "url": "https://www.socialstyrelsen.se/kunskapsstod-och-regler/omraden/ekonomiskt-bistand/ekonomiskt-bistand-for-privatpersoner/",
      "geography": "SE",
      "coverage": ["social_assistance", "low_income", "municipal_support", "debt_guidance"],
      "source_type": "official_guidance",
      "ingestion_method": "html_guidance",
      "priority": "P0",
      "suggested_review_frequency_days": 14,
      "source_verification_status": "SOURCE_VERIFIED",
      "last_source_check": "2026-09-05",
      "adapter_state": "CANDIDATE"
    },
    {
      "source_id": "se-boverket-housing-adaptation",
      "owner": "Boverket",
      "authority_type": "national_agency",
      "url": "https://www.boverket.se/sv/om-boverket/lattlast-pa-boverket/bidrag-och-stod/bostadsanpassningsbidrag/",
      "geography": "SE",
      "coverage": ["housing", "disability", "municipal_grant"],
      "source_type": "official_guidance",
      "ingestion_method": "html_guidance",
      "priority": "P1",
      "suggested_review_frequency_days": 30,
      "source_verification_status": "SOURCE_VERIFIED",
      "last_source_check": "2026-09-05",
      "adapter_state": "CANDIDATE"
    },
    {
      "source_id": "se-boverket-small-house-energy-grant",
      "owner": "Boverket",
      "authority_type": "national_agency",
      "url": "https://www.boverket.se/sv/bidrag--garantier/bidrag-for-energieffektivisering-i-smahus/",
      "geography": "SE",
      "coverage": ["housing", "energy", "small_house", "renovation", "grant"],
      "source_type": "official_guidance",
      "ingestion_method": "html_guidance",
      "priority": "P0",
      "suggested_review_frequency_days": 7,
      "source_verification_status": "SOURCE_VERIFIED",
      "last_source_check": "2026-09-14",
      "adapter_state": "CANDIDATE",
      "notes": "Current primary guidance for the 2026 small-house energy-efficiency grant (Villaeffekten). Material eligibility, application timing and decision authority must stay grounded in current Boverket guidance plus the current SFS; source verification does not imply user eligibility."
    },
    {
      "source_id": "se-naturvardsverket-ladda-bilen-association",
      "owner": "Naturvårdsverket",
      "authority_type": "national_agency",
      "url": "https://www.naturvardsverket.se/amnesomraden/klimatomstallningen/ladda-bilen/ladda-bilen-for-foreningar-och-boendeorganisationer/",
      "geography": "SE",
      "coverage": ["housing", "energy", "mobility", "ev_charging", "associations", "property"],
      "source_type": "official_guidance",
      "ingestion_method": "html_guidance",
      "priority": "P0",
      "suggested_review_frequency_days": 7,
      "source_verification_status": "SOURCE_VERIFIED",
      "last_source_check": "2026-09-14",
      "adapter_state": "CANDIDATE",
      "notes": "Association/boendeorganisation charging guidance. User category and economic-activity context affect support/timing rules. Source verification does not mean a project is eligible or a stated cap is guaranteed."
    },
    {
      "source_id": "se-riksdagen-resident-charging-right",
      "owner": "Sveriges riksdag",
      "authority_type": "parliament",
      "url": "https://data.riksdagen.se/dokument/sfs-1991-614.html",
      "geography": "SE",
      "coverage": ["housing", "ev_charging", "condominium", "rights"],
      "source_type": "official_legislation",
      "ingestion_method": "html_legislation",
      "priority": "P0",
      "suggested_review_frequency_days": 30,
      "source_verification_status": "SOURCE_VERIFIED",
      "last_source_check": "2026-09-14",
      "adapter_state": "CANDIDATE",
      "notes": "Current Bostadsrättslag (1991:614), 7 kap. 9 a §, for a bostadsrättshavare's 2026 charging-point request. This source does not cover a tenant request under Jordabalken and does not imply unconditional approval in an individual case."
    },
    {
      "source_id": "se-riksdagen-tenant-charging-right",
      "owner": "Sveriges riksdag",
      "authority_type": "parliament",
      "url": "https://data.riksdagen.se/dokument/sfs-1970-994.html",
      "geography": "SE",
      "coverage": ["housing", "ev_charging", "tenant", "rights"],
      "source_type": "official_legislation",
      "ingestion_method": "html_legislation",
      "priority": "P0",
      "suggested_review_frequency_days": 30,
      "source_verification_status": "SOURCE_VERIFIED",
      "last_source_check": "2026-09-14",
      "adapter_state": "CANDIDATE",
      "notes": "Current Jordabalk (1970:994), 12 kap. 27 a §, for a hyresgäst's 2026 charging-point request. This source does not cover a bostadsrättshavare request under Bostadsrättslagen and does not imply unconditional approval in an individual case."
    },
    {
      "source_id": "se-lansstyrelserna-foundation-search",
      "owner": "Länsstyrelserna",
      "authority_type": "government_registry",
      "url": "https://stiftelser.lansstyrelsen.se/",
      "geography": "SE",
      "coverage": ["foundations", "grants", "scholarships", "civil_society"],
      "source_type": "official_registry",
      "ingestion_method": "search_portal",
      "priority": "P0",
      "suggested_review_frequency_days": 30,
      "source_verification_status": "SOURCE_VERIFIED",
      "last_source_check": "2026-09-05",
      "adapter_state": "SPECIAL_HANDLING_REQUIRED",
      "notes": "Treat registry discovery separately from support verification. A registered foundation is not automatically an open or currently payable grant."
    },
    {
      "source_id": "se-arvsfonden-services",
      "owner": "Allmänna arvsfonden",
      "authority_type": "national_fund",
      "url": "https://tjanster.arvsfonden.se/",
      "geography": "SE",
      "coverage": ["civil_society", "children", "youth", "disability", "older_people", "project_grants", "facility_grants"],